{
  "$schema": "./inventory.schema.json",
  "version": 1,

  "_readme": [
    "STARTER TEMPLATE. Copy this to inventory.json, edit it to match the machines",
    "you actually own, then run `npm run inventory:sync`.",
    "",
    "  cp inventory.example.json inventory.json",
    "  $EDITOR inventory.json",
    "  npm run inventory:sync",
    "",
    "Out of the box this assumes one thing: Ollama on this machine at its default",
    "port. If you have that running, `check_health` goes green with no edits.",
    "Everything else is disabled until you turn it on."
  ],

  "policy": {
    "selfHostedFirst": true,
    "cloudEscalation": {
      "optIn": false,
      "note": "Cloud is strictly opt-in. While optIn is false, routing and fallback never select cloud hosts, even when every self-hosted lane is unreachable. Set optIn to true or export XX_STACK_ALLOW_CLOUD=1 to enable it."
    },
    "laneOrder": ["local", "tailscale-openai-compatible", "tailscale-ollama", "cloud"]
  },

  "machines": [
    {
      "id": "local-workstation",
      "label": "This workstation",
      "network": { "scope": "localhost", "address": "127.0.0.1" },
      "hardware": {
        "summary": "Detected during setup",
        "cpu": "Detected during setup",
        "ram": "Detected during setup",
        "gpu": [],
        "limits": ["Best for low-latency coding and iterative execution"]
      },
      "execution": {
        "maxParallelSlices": 2,
        "maxConcurrentModels": 1,
        "contextReservePercent": 25,
        "scheduling": "serial-per-model"
      },
      "delegation": {
        "preferredTaskTypes": ["quick-verify", "small-fix", "interactive-coding", "offline-fallback"]
      },
      "runtimes": [
        {
          "kind": "ollama",
          "port": 11434,
          "enabled": true,
          "primary": true,
          "notes": "Ollama's default port. This is the one lane enabled out of the box — if `ollama serve` is running, the stack works with no edits.",
          "models": []
        },
        {
          "kind": "llama-cpp",
          "port": 8080,
          "enabled": false,
          "notes": "Enable if you run llama-server locally on :8080.",
          "models": []
        }
      ]
    },

    {
      "id": "example-gpu-box",
      "label": "Example remote GPU box",
      "network": {
        "scope": "tailscale",
        "address": "example-gpu-box",
        "notes": "DELETE THIS MACHINE or replace it with a real one. Reached over Tailscale by MagicDNS name. Do not expose these ports publicly; bind them to the tailnet interface (find it with `tailscale ip -4` on the box) or firewall them to the tailnet."
      },
      "hardware": {
        "summary": "Example remote inference host",
        "gpu": [{ "name": "NVIDIA RTX 4090", "count": 2, "vramGb": 24 }],
        "detected": { "gpuCount": 2, "totalGpuVramGb": 48 },
        "limits": ["Prefer the OpenAI-compatible lane for long-context and high-throughput work"]
      },
      "execution": {
        "maxParallelSlices": 4,
        "maxConcurrentModels": 2,
        "contextReservePercent": 20,
        "scheduling": "throughput"
      },
      "delegation": {
        "preferredTaskTypes": ["planning", "architecture", "multi-step reasoning", "broad research"],
        "avoidTaskTypes": ["tight edit-run-edit loops", "low-latency interactive coding"]
      },
      "runtimes": [
        {
          "kind": "sglang",
          "port": 30000,
          "enabled": false,
          "hermesPriority": 100,
          "notes": "Example. sglang batches concurrent requests across GPUs, so parallel slices are cheap relative to sequential execution.",
          "models": []
        },
        {
          "kind": "ollama",
          "port": 11434,
          "enabled": false,
          "hermesPriority": 70,
          "notes": "Example compatibility lane. Ollama binds to 127.0.0.1 by default and is not reachable over Tailscale until you set OLLAMA_HOST on the box and restart it.",
          "models": []
        }
      ]
    }
  ],

  "aggregators": [
    {
      "id": "hermes-proxy",
      "label": "Hermes local-first control plane (loopback proxy)",
      "kind": "hermes",
      "network": { "scope": "loopback", "address": "127.0.0.1" },
      "port": 8180,
      "enabled": false,
      "notes": "OpenAI-compatible loopback proxy exposed by hermes-orchestration. Start it with `python3 hermes-orchestration/scripts/hermes_orchestrator.py serve` and export HERMES_PROXY_TOKEN. Enabling it delegates lane selection to Hermes instead of routing to a backend directly. Leave disabled if you would rather address machines directly — the two approaches are alternatives, not layers.",
      "execution": {
        "maxParallelSlices": 4,
        "maxConcurrentModels": 1,
        "contextReservePercent": 20,
        "scheduling": "parallel-batched"
      },
      "models": [
        {
          "name": "hermes-auto",
          "roles": ["implement", "plan", "reason", "fallback"],
          "priority": "medium",
          "toolCallReliability": "unverified",
          "jsonModeReliability": "unverified",
          "notes": "Virtual model name — Hermes resolves the real backend per its own lane policy."
        }
      ]
    }
  ],

  "cloud": {
    "providers": [
      {
        "id": "openai-compatible-template",
        "label": "Generic OpenAI-compatible cloud endpoint",
        "provider": "openai-compatible",
        "endpoint": "https://example.invalid/v1",
        "enabled": false,
        "notes": "Template. Replace endpoint and models with a real provider if you opt in to cloud."
      }
    ]
  }
}
